<?xml version='1.0' encoding='UTF-8'?>
<!DOCTYPE dataset PUBLIC "-//SZE_TEAM//DTD sze-db 1.0//EN" "../../checkberry/db/sze-db.dtd">
<dataset>
  <ZEUGNIS ID="1" VERSION="0" ANZAHL_FEHLTAGE_GESAMT="0" ANZAHL_FEHLTAGE_UNENTSCHULDIGT="0" ANZAHL_VERSPAETUNGEN="0" BU_BEWERTUNGS_TEXT="" KLASSEN_ZIEL_AUSGESCHLOSSEN="false" KLASSEN_ZIEL_GEFAEHRDET="false" KLASSEN_ZIEL_WURDE_NICHT_ERREICHT="false" RUECKT_AUF="true" FORMULAR_ID="1" KLASSE_ID="1" SCHUELER_ID="1" SCHULHALBJAHR_ID="1" ZEUGNIS_ART_ID="1"/>
  <ZEUGNIS ID="2" VERSION="0" ANZAHL_FEHLTAGE_GESAMT="0" ANZAHL_FEHLTAGE_UNENTSCHULDIGT="0" ANZAHL_VERSPAETUNGEN="0" BU_BEWERTUNGS_TEXT="" KLASSEN_ZIEL_AUSGESCHLOSSEN="false" KLASSEN_ZIEL_GEFAEHRDET="false" KLASSEN_ZIEL_WURDE_NICHT_ERREICHT="false" RUECKT_AUF="true" FORMULAR_ID="1" KLASSE_ID="1" SCHUELER_ID="2" SCHULHALBJAHR_ID="1" ZEUGNIS_ART_ID="1"/>
  <AG_BEWERTUNG ID="1" VERSION="0" TEILGENOMMEN="false" ARBEITSGRUPPE_ID="2" ZEUGNIS_ID="1"/>
  <AG_BEWERTUNG ID="2" VERSION="0" TEILGENOMMEN="false" ARBEITSGRUPPE_ID="7" ZEUGNIS_ID="1"/>
  <AG_BEWERTUNG ID="3" VERSION="0" TEILGENOMMEN="false" ARBEITSGRUPPE_ID="2" ZEUGNIS_ID="2"/>
  <AG_BEWERTUNG ID="4" VERSION="0" TEILGENOMMEN="false" ARBEITSGRUPPE_ID="7" ZEUGNIS_ID="2"/>
  <AV_SV_BEWERTUNG ID="1" VERSION="0" ARBEITS_UND_SOZIAL_VERHALTEN_ID="1" ZEUGNIS_ID="1"/>
  <AV_SV_BEWERTUNG ID="2" VERSION="0" ARBEITS_UND_SOZIAL_VERHALTEN_ID="10" ZEUGNIS_ID="1"/>
  <AV_SV_BEWERTUNG ID="3" VERSION="0" ARBEITS_UND_SOZIAL_VERHALTEN_ID="1" ZEUGNIS_ID="2"/>
  <AV_SV_BEWERTUNG ID="4" VERSION="0" ARBEITS_UND_SOZIAL_VERHALTEN_ID="10" ZEUGNIS_ID="2"/>
  <BEWERTUNG CLASS="net.sf.sze.zeugnis.AussenDifferenzierteBewertung" ID="1" VERSION="0" LEISTUNG_NUR_SCHWACH_AUSREICHEND="false" LEISTUNGSNIVEAU="G" RELEVANT="true" SONDER_NOTE="" SCHULFACH_ID="1" ZEUGNIS_ID="1"/>
  <BEWERTUNG CLASS="net.sf.sze.zeugnis.BinnenDifferenzierteBewertung" ID="2" VERSION="0" LEISTUNG_NUR_SCHWACH_AUSREICHEND="false" LEISTUNGSNIVEAU="G" RELEVANT="true" SONDER_NOTE="" SCHULFACH_ID="2" ZEUGNIS_ID="1"/>
  <BEWERTUNG CLASS="net.sf.sze.zeugnis.StandardBewertung" ID="3" VERSION="0" LEISTUNG_NUR_SCHWACH_AUSREICHEND="false" RELEVANT="true" SONDER_NOTE="" SCHULFACH_ID="4" ZEUGNIS_ID="1"/>
  <BEWERTUNG CLASS="net.sf.sze.zeugnis.StandardBewertung" ID="4" VERSION="0" LEISTUNG_NUR_SCHWACH_AUSREICHEND="false" RELEVANT="false" SONDER_NOTE="" SCHULFACH_ID="12" ZEUGNIS_ID="1"/>
  <BEWERTUNG CLASS="net.sf.sze.zeugnis.AussenDifferenzierteBewertung" ID="5" VERSION="0" LEISTUNG_NUR_SCHWACH_AUSREICHEND="false" LEISTUNGSNIVEAU="G" RELEVANT="true" SONDER_NOTE="" SCHULFACH_ID="1" ZEUGNIS_ID="2"/>
  <BEWERTUNG CLASS="net.sf.sze.zeugnis.BinnenDifferenzierteBewertung" ID="6" VERSION="0" LEISTUNG_NUR_SCHWACH_AUSREICHEND="false" LEISTUNGSNIVEAU="G" RELEVANT="true" SONDER_NOTE="" SCHULFACH_ID="2" ZEUGNIS_ID="2"/>
  <BEWERTUNG CLASS="net.sf.sze.zeugnis.StandardBewertung" ID="7" VERSION="0" LEISTUNG_NUR_SCHWACH_AUSREICHEND="false" RELEVANT="true" SONDER_NOTE="" SCHULFACH_ID="4" ZEUGNIS_ID="2"/>
  <BEWERTUNG CLASS="net.sf.sze.zeugnis.StandardBewertung" ID="8" VERSION="0" LEISTUNG_NUR_SCHWACH_AUSREICHEND="false" RELEVANT="false" SONDER_NOTE="" SCHULFACH_ID="12" ZEUGNIS_ID="2"/>
</dataset>
