<?xml version='1.0' encoding='UTF-8'?>
<!DOCTYPE dataset PUBLIC "-//SZE_TEAM//DTD sze-db 1.0//EN" "checkberry/db/sze-db.dtd">
<dataset>
    <INCLUDE FILE="net/sf/sze/stammdaten.xml" LOCATION="CLASSPATH" />
    <!-- TODO Funktion um Klassenalter fix zu machen. -->
    <KLASSE ID="1" GESCHLOSSEN="false" JAHRGANG="1999" SUFFIX=""
        VERSION="0" />
    <SCHUELER ID="1" VERSION="0" GEBURTSTAG="1992-06-15" GEBURTSORT="Hamburg" KLASSE_ID="1" VORNAME="ERWIN" GESCHLECHT="0" NAME="MUSTERMANN" />
    <SCHUELER ID="2" VERSION="0" GEBURTSTAG="1992-03-15" GEBURTSORT="Kiel" KLASSE_ID="1" VORNAME="ERNA" GESCHLECHT="1" NAME="MUSTERFRAU" />

    <SCHULHALBJAHR ID="1" HALBJAHR="0" SELECTABLE="true"
        VERSION="0" JAHR="2013" />
    <SCHULHALBJAHR ID="2" HALBJAHR="1" SELECTABLE="true"
        VERSION="0" JAHR="2013" />
    <ZEUGNIS_FORMULAR SCHULHALBJAHR_ID="1"
        TEMPLATE_FILE_NAME="egal" KLASSE_ID="1" ID="1" AUSGABE_DATUM="2013-01-31"
        BESCHREIBUNG="2013 erstes Halbjahr" VERSION="0"
        NACHTEILS_AUSGLEICHS_DATUM="2012-09-14" />
    <ZEUGNIS_FORMULAR ID="2" SCHULHALBJAHR_ID="2"
        TEMPLATE_FILE_NAME="egal" KLASSE_ID="1" AUSGABE_DATUM="2013-06-31"
        BESCHREIBUNG="2013 zweites Halbjahr" VERSION="0"
        NACHTEILS_AUSGLEICHS_DATUM="2012-09-14" />
</dataset>
